08:49:55.824453 ARP, Request who-has 192.168.43.22 tell 192.168.43.52, length 28
08:49:55.824482 ARP, Reply 192.168.43.22 is-at b0:52:16:3c:6d:55, length 28
08:50:05.007280 ARP, Request who-has 192.168.43.54 tell 192.168.43.22, length 28
08:50:06.034823 ARP, Request who-has 192.168.43.54 tell 192.168.43.22, length 28
08:50:07.058764 ARP, Request who-has 192.168.43.54 tell 192.168.43.22, length 28
08:50:08.082700 ARP, Request who-has 192.168.43.54 tell 192.168.43.22, length 28
08:50:09.106744 ARP, Request who-has 192.168.43.54 tell 192.168.43.22, length 28
08:50:10.130686 ARP, Request who-has 192.168.43.54 tell 192.168.43.22, length 28
08:50:12.124209 ARP, Request who-has 192.168.43.54 tell 192.168.43.22, length 28
08:50:13.138754 ARP, Request who-has 192.168.43.54 tell 192.168.43.22, length 28
08:50:14.162746 ARP, Request who-has 192.168.43.54 tell 192.168.43.22, length 28
08:50:15.186939 ARP, Request who-has 192.168.43.54 tell 192.168.43.22, length 28
08:50:16.210732 ARP, Request who-has 192.168.43.54 tell 192.168.43.22, length 28
08:50:17.234730 ARP, Request who-has 192.168.43.54 tell 192.168.43.22, length 28
08:50:19.228315 ARP, Request who-has 192.168.43.54 tell 192.168.43.22, length 28
08:50:20.242756 ARP, Request who-has 192.168.43.54 tell 192.168.43.22, length 28
08:50:21.266759 ARP, Request who-has 192.168.43.54 tell 192.168.43.22, length 28
08:50:22.291147 ARP, Request who-has 192.168.43.54 tell 192.168.43.22, length 28
08:50:23.314685 ARP, Request who-has 192.168.43.54 tell 192.168.43.22, length 28
08:50:24.338748 ARP, Request who-has 192.168.43.54 tell 192.168.43.22, length 28
08:50:25.363099 ARP, Request who-has 192.168.43.54 tell 192.168.43.22, length 28
08:50:26.386760 ARP, Request who-has 192.168.43.54 tell 192.168.43.22, length 28
08:50:26.514731 ARP, Request who-has 192.168.43.52 tell 192.168.43.22, length 28
08:50:26.519887 ARP, Reply 192.168.43.52 is-at 3a:9a:36:cc:b1:16, length 28
08:50:27.410779 ARP, Request who-has 192.168.43.54 tell 192.168.43.22, length 28
08:50:28.435078 ARP, Request who-has 192.168.43.54 tell 192.168.43.22, length 28
08:50:29.458741 ARP, Request who-has 192.168.43.54 tell 192.168.43.22, length 28
08:50:30.482755 ARP, Request who-has 192.168.43.54 tell 192.168.43.22, length 28
08:50:31.507054 ARP, Request who-has 192.168.43.54 tell 192.168.43.22, length 28
08:50:32.530741 ARP, Request who-has 192.168.43.54 tell 192.168.43.22, length 28
08:50:33.554748 ARP, Request who-has 192.168.43.54 tell 192.168.43.22, length 28
08:50:34.578991 ARP, Request who-has 192.168.43.54 tell 192.168.43.22, length 28
08:50:35.602729 ARP, Request who-has 192.168.43.54 tell 192.168.43.22, length 28
08:50:36.626626 ARP, Request who-has 192.168.43.54 tell 192.168.43.22, length 28
08:50:37.651060 ARP, Request who-has 192.168.43.54 tell 192.168.43.22, length 28
08:50:38.674713 ARP, Request who-has 192.168.43.54 tell 192.168.43.22, length 28
08:50:39.698677 ARP, Request who-has 192.168.43.54 tell 192.168.43.22, length 28
08:50:40.723003 ARP, Request who-has 192.168.43.54 tell 192.168.43.22, length 28
08:50:41.746739 ARP, Request who-has 192.168.43.54 tell 192.168.43.22, length 28
08:50:42.770698 ARP, Request who-has 192.168.43.54 tell 192.168.43.22, length 28
08:50:43.794796 ARP, Request who-has 192.168.43.54 tell 192.168.43.22, length 28
08:50:44.818655 ARP, Request who-has 192.168.43.54 tell 192.168.43.22, length 28
08:50:45.842624 ARP, Request who-has 192.168.43.54 tell 192.168.43.22, length 28
08:50:47.836065 ARP, Request who-has 192.168.43.54 tell 192.168.43.22, length 28
08:50:48.850608 ARP, Request who-has 192.168.43.54 tell 192.168.43.22, length 28
08:50:49.874628 ARP, Request who-has 192.168.43.54 tell 192.168.43.22, length 28
08:50:50.898893 ARP, Request who-has 192.168.43.54 tell 192.168.43.22, length 28
08:50:51.922681 ARP, Request who-has 192.168.43.54 tell 192.168.43.22, length 28
08:50:52.946634 ARP, Request who-has 192.168.43.54 tell 192.168.43.22, length 28
08:50:54.940138 ARP, Request who-has 192.168.43.54 tell 192.168.43.22, length 28
08:50:55.954636 ARP, Request who-has 192.168.43.54 tell 
